"Document ID","Document Title",Categories,"Number of Views"
457287,"PT Doc One","Category One, Parent",4
457317,"Federal Health IT Strategic Plan (2020-2025)","Category Five, Category Four, Category One",2
457299,"Physician Notification Report","Category Four, Category One, Parent",1
457312,"Tuberculosis in the United States, 1993-2019 Presentation and Slide Deck Narrative","Category Three, Category Two",1
457313,"COVID-19 Nursing Home Data (October 18, 2020)","Category Five, Category Four, Category One",1
457314,"COVIDView Week 41 (Week Ending October 10, 2020)","Category Five, Category Four, Category Three",1
457316,"COVID View Week 43 (Week Ending October 24, 2020)","Category Five, Category Two, Parent",1
